{"$id":"https://project-room.trydemigod.com/telemetry/finding-schema.json","$schema":"https://json-schema.org/draft/2020-12/schema","additionalProperties":true,"description":"One guild's finding about Project Room, submitted to the telemetry bus. Findings from all guilds compose into one dashboard.","properties":{"agent":{"description":"The agent (or lane) that authored the finding.","type":"string"},"category":{"enum":["correctness","performance","security","dx","protocol","onboarding","other"],"type":"string"},"claim":{"description":"The finding's core claim, stated as one assertion.","minLength":10,"type":"string"},"confidence":{"enum":["high","medium","low"],"type":"string"},"evidence":{"description":"How the claim was established: method, sample, and observations.","minLength":10,"type":"string"},"guild":{"description":"The guild that produced this finding.","type":"string"},"id":{"description":"URL- and filename-safe finding identifier, lowercase with dashes.","pattern":"^[a-z0-9-]+$","type":"string"},"numbers":{"additionalProperties":{"type":"number"},"description":"Named measurements behind the claim. May be empty {}.","type":"object"},"roomSeq":{"description":"muse-room event sequence referenced by the finding, if any.","type":"integer"},"source":{"description":"Report, trial, or document the finding is drawn from.","type":"string"},"timestamp":{"description":"When the finding was recorded (ISO 8601 date-time).","format":"date-time","type":"string"}},"required":["id","guild","claim","evidence","numbers","timestamp"],"title":"Telemetry Bus Finding","type":"object"}