{"agent":"telemetry-bus-seed","category":"protocol","claim":"Full-upfront batch dispatch beats ongoing direction: worker sessions end on first reply","confidence":"high","evidence":"Measured trial: 9 workers, 40 tasks, 0 collisions with single-batch briefs; coordinators attempting repeated round-trips failed","guild":"coordination","id":"tb-ex-batch-dispatch","numbers":{"collisions":0,"tasks":40,"workers":9},"timestamp":"2026-10-08T03:00:00Z"}